question,answer1,answer2,answer3,answer4,answer5,answer6,correct_answer
"An AEM Developer has created a custom component and wants to start using it on a page within a local AEM instance. The developer currently has no means by which to add the component to the page or any other page within the instance. What does the developer need to run to deploy the code to the instance?","$mvn update install -PautolnstallSinglePackage","$mvn clean install -PautolnstallSinglePackage","$mvn install -PautolnstallSinglePackage","$mvn update -PautolnstallSinglePackage","","","b"
"A new AEM developer wants to create a workflow model programmatically. The developer wants to create a folder called workflowdrafts in the correct folder within AEM. What does the complete path to the model look like?","/var/packages/workflow/models/workflowdrafts","/var/workflow/workflowdrafts","/var/models/workflowdrafts","/var/workflow/models/workflowdrafts","","","d"
"An AEM developer wants to load CSS files of a client library into a webpage. The developer has completed most of the code but does not know what to put in the missing space. Which code should fill the missing space in this code example? <head> <!-- HTML meta-data --> <sly _______ = ""${clientlib.css @ categories='myCategory'}"" /> </head>","data-sly-call","data-sly","data-sly-get","data-sly-use","","","a"
"An app needs a workflow to trigger another workflow. Which type of workflow step, when run, starts another workflow model?","Join","Process","Split","Container","","","d"
"An instance of AEM is running CRX2 and will require a migration to Oak (CRX3) when upgrading directly to AEM 6.5. Which version of AEM is running?","5.6","6.2","6.0","6.1","","","c"
"What needs to be run to produce the clientlib-site and clientlib-dependencies client libraries into the ui.apps back-end module?","npm run dev","mvn run dev","mvn clean install -PautolnstallPackage","npm clean install - PautolnstallPackage","","","a"
"Within the AEM Project Archetype, developer is looking for add browser plug-ins within the main folder of the project. The developer also wants to add Ul-based plugins and knows there is a file with plugin sections to where plugin configurations can be defined. Which file is that?","Parent POM","plugins.xml","ui.apps/pom.xml","filter.xml","","","a"
"A new developer changes a workflow after it has been run for the first time. However, upon testing the workflow, the changes are not reflected when the workflow runs. What is the most likely cause of this problem?","The workflow needs to be debugged first","A new version of the runtime version was not saved","The runtime version of the workflow was not updated","The Sync was not triggered in the workflow model","","","d"
"For a default installation of AEM, on which port does the Author instance run?","8080","4503","4502","80","","","c"
"A developer wants to use the AEM Project Archetype as the developer as the developer is working on a minimal, best-practice based AEM project. The archetype is based off which type of template?","Gradle","React.js","Angular.js","Maven","","","d"
"A new AEM administrator needs to learn the URL for the Configuration tab of the Web Console for an AEM instance on a local server. Which path should the administrator use to get to the console?","//localhost:4502/webConsole/configMgr","//localhost:4502/console/configMgr","//localhost:4502/system/console/configMgr","//localhost:4502/system/webConsole/configMgr","","","c"
"A developer is in the Environments area of an AEM instance and can access the Developer Console for all versions of the instance. A user wants to run some tests within a Developer Console. The company has a strict policy against allowing non-developers to be in the Developer Console within a production, stage, or development environment. What should be set up to allow the user to use the Developer Console?","Make the user an administrator","Ensure the user has access to the Cloud Manager Sandbox Program","Set up a new test AEM environment","Set up a test sandbox instance","","","b"
"A developer wants to add a list of IP addresses to be allowed in the Author version of an app. The developer navigates to the Environments screen but does not have access to the IP Allow Lists area. The same problem exists when the developer navigates to the Publish version of the app. Which roles are eligible to add an IP Allow list? (Choose two)","List Manager","Site Administrator","Deployment Manager","Business Owner","","","d"